<?xml version="1.0" encoding="utf-8"?>
<!DOCTYPE firma SYSTEM "zad5.dtd">
<firma>
	<nazwa>XmlCompany</nazwa>		
	<dzial> 
		<pracownik plec="m" numer_pesel="jednoslowo" opis="opcjonalne"> 
			<imie> Marcel</imie>
			<nazwisko>Dajnowicz</nazwisko>
			<data_ur>9 maj 1997</data_ur>
		</pracownik>
		<pracownik plec="k" numer_pesel="1212123" opis="jestem cool">
			<imie>Ja</imie>
			<nazwisko>Firana</nazwisko>
			<data_ur>10 czerwca 2000</data_ur>
		</pracownik>
	</dzial>
</firma>
